{"schema":"io.chipltech.plugin-migration-evidence/v1","source_governance":{"status":"not_applicable","owner":"restricted-reference-governance","artifact_path":"","artifact_id":"sha256:1111111111111111111111111111111111111111111111111111111111111111","fresh":true,"authority":"operational_only"},"source_migration":{"status":"pass","owner":"pytorch-dlc-plugin-migration","artifact_path":"","artifact_id":"sha256:1111111111111111111111111111111111111111111111111111111111111111","fresh":true,"authority":"operational_only"},"compile_link":{"status":"pass","owner":"pytorch-dlc-plugin-migration","artifact_path":"","artifact_id":"sha256:1111111111111111111111111111111111111111111111111111111111111111","fresh":true,"authority":"operational_only"},"wheel_import":{"status":"pass","owner":"pytorch-dlc-plugin-migration","artifact_path":"","artifact_id":"sha256:1111111111111111111111111111111111111111111111111111111111111111","fresh":true,"authority":"operational_only"},"stack_preflight":{"status":"pass","owner":"dlc-env-setup","artifact_path":"","artifact_id":"sha256:1111111111111111111111111111111111111111111111111111111111111111","fresh":true,"authority":"operational_only"},"package_seal":{"status":"pass","owner":"package-provider","artifact_path":"","artifact_id":"sha256:1111111111111111111111111111111111111111111111111111111111111111","fresh":true,"authority":"operational_only"},"dlc_runtime_execution":{"status":"not_verified","owner":"dlc-env-setup","artifact_path":"","artifact_id":"sha256:1111111111111111111111111111111111111111111111111111111111111111","fresh":true,"authority":"operational_only"},"real_dlc_hardware_behavior":{"status":"not_verified","owner":"pytorch-dlc-plugin-migration","artifact_path":"","artifact_id":"sha256:1111111111111111111111111111111111111111111111111111111111111111","fresh":true,"authority":"operational_only"},"smi_observation":{"status":"not_applicable","owner":"dlc-hardware-observability","artifact_path":"","artifact_id":"sha256:1111111111111111111111111111111111111111111111111111111111111111","fresh":true,"authority":"operational_only"},"distributed_behavior":{"status":"not_applicable","owner":"distributed-qualification","artifact_path":"","artifact_id":"sha256:1111111111111111111111111111111111111111111111111111111111111111","fresh":true,"authority":"operational_only"},"cleanup":{"status":"pass","owner":"dlc-hardware-observability","artifact_path":"","artifact_id":"sha256:1111111111111111111111111111111111111111111111111111111111111111","fresh":true,"authority":"operational_only"},"device_deferral_permitted":true}
